,Company/Brand,Sector,Stage,Amount($),HeadQuarter,What it does,Year
380,CashRich,Apps,Seed,1000000,Mumbai,A Mumbai-based fin-tech startup,2018
381,Cloudnine Hospitals,Child Care,Private Equity,0,Bangalore,Cloudnine is an Indian chain of women and child care hospitals.,2018
382,CropIn Technologies,Agriculture,Series B,8478132,Bengaluru,"To discover, develop and deliver innovative solution in Agtech Space",2018
383,Billdesk,Finance,Venture - Series Unknown,0,Ahmedabad,"BillDesk, a property of IndiaIdeas.com Ltd. was conceived in early 2000 to solve the frustrations of most of us when it comes to paying",2018
384,Yaantra,Information Services,Debt Financing,2000000,Delhi,"Yaantra, India’s leading mobile phone repair, refurbished & Unboxed centre In India",2018
385,TECHBOOZE,Education,Seed,100000,New Delhi,"Techbooze[1] ""AN OPEN FORUM"" is an educational enterprise, headquartered in India working across the country.",2018
386,HealthifyMe,Apps,Series B,6000000,Bangalore,HealthifyMe is an application that allows its users to achieve their fitness and weight loss goals from their computers and smartphones.,2018
387,hoi foods,Food and Beverage,Seed,526229,Gurgaon,India's first hotel dedicated food brand which promises great in room dining experience in budget hotels,2018
388,Perpule,Apps,Series A,4969939,Bangalore,Perpule is a self-checkout product for retail outlets to enhance the shopping experience of the customers.,2018
389,Royal Sundaram General Insurance Co. Limited,Health Insurance,Corporate Round,210000000,Kalpakkam,"Royal Sundaram provides comprehensive insurance plans and innovative insurance solutions to individuals, families and businesses.",2018
390,CleanseCar,Automotive,Angel,511611,Bangalore,CleanseCar is a company provides Washing and Repair Services.,2018
391,DRIVEU,Rental,Venture - Series Unknown,1023223,Bengaluru,DriveU is a convenient and a quick way of getting on demand drivers for consumers and businesses,2018
392,Spinny,E-Commerce,Series A,11000000,Gurgaon,Used cars marketplace in India. Ushering new era of transparency and convenience.,2018
393,Asset Reconstruction Company (India) Ltd.,Financial Services,Secondary Market,0,Mumbai,Asset Reconstruction Company (India) Ltd. operates as a asset reconstruction company.,2018
394,Med365 Healthcare,Health Diagnostics,Seed,730873,Jaipur,"Wellness, Specialised Testing, Healthcare at Home",2018
395,Dunzo,Customer Service,Debt Financing,1023223,Bangalore,Dunzo is an app that connects you with the nearest available delivery partner to pickup or deliver items for you.,2018
396,Mobile Premier League (MPL),Gaming,Series A,5000000,Bengaluru,Mobile Premier League(MPL) is a skill based E-Sports platform where you can play your favourite mobile games and win real cash always.,2018
397,WalMart India,Retail,Venture - Series Unknown,37680000,Gurgaon,"Wal-Mart India Private Limited is a wholly owned subsidiary of Walmart Stores Inc.,",2018
398,Cred,,Seed,0,Bengaluru,Cred is a platform to celebrate and reward the most creditworthy people of India.,2018
399,Meesho,E-Commerce,Series C,50000000,Bangalore,"Meesho is an online reseller network of housewives and SMBs, who sell products within their network on social channels.",2018
400,BhaskarGuru,Search Engine,Seed,1000000,Bhopal,Bhaskarguru.com is your local search Engine,2018
401,Gugu,Battery,Seed,250000,Coimbatore,Gugu designs & Sells all Electric Connected Two-wheeler's with Network of Open & Free Fast charging Stations across India.,2018
402,FarmTaaza,Agriculture,Series A,0,Bengaluru,Farm Taaza provides expert advice to the farmers on improving the yield and improving the field operations of the farmer.,2018
403,Vizzbee,Artificial Intelligence,Pre-Seed,20000,Bhopal,Autonomous Drone Solutions for last mile delivery as well as search and rescue,2018
404,BIGPHI TECHNOLOGIES PVT. LTD.,Fashion,Angel,900000,Bangalore,BIGPHI technologies is the India's first technologically advanced apparel and wearable company.,2018
405,Mobycy,Fitness,Angel,0,Gurgaon,India's 1st Dockless Bicycle Sharing App,2018
406,Traveo Soft Pvt. Ltd.,Mobile,Undisclosed,17541,Bangalore,AI based Business Travel & Expense management,2018
407,Em Personal Care,Cosmetics,Seed,0,Worli,Em Personal Care is a Cosmetic products manufacturing Company.,2018
408,Lucideus,Consulting,Venture - Series Unknown,5000000,New Delhi,"Lucideus is a cybersecurity company that offers its customers with consultancy, training, and solutions to counteract cyber-attacks.",2018
409,Eupheus Learning,E-Learning,Seed,0,Delhi,Eupheus Learning offers a seamless integrated learning solution for the K-12 market in India.,2018
410,GamingMonk,eSports,Series A,584699,New Delhi,"GamingMonk is an eSports gaming company based out of New Delhi, India.",2018
411,Sukkhi Jewellery,Fashion,Venture - Series Unknown,7454909,Mumbai,Sukkhi Jewellery is a Contemporary fashion jewellery brand.,2018
412,INDwealth,Financial Services,Seed,32158430,Gurgaon,INDwealth is an Artificial Intelligence (AI) powered wealth management company,2018
413,Medikabazaar,B2B,Series A,5000000,Mumbai,India's largest medical and surgical supplies marketplace,2018
414,NIRA,Credit,Seed,1000000,Bangalore,"NIRA promotes financial inclusion by creating simple, transparent products that empower individuals to live a life of choice and freedom.",2018
415,Duroflex Pvt. Ltd.,Consumer Goods,Private Equity,22000000,Alleppey,Duroflex Pvt. Ltd. operates as a dominant mattress player.,2018
416,Clensta,Biotechnology,Seed,0,New Delhi,A biotechnology start-up was incorporated to improve the National Hygiene condition whilst addressing the aspect of water conservation.,2018
417,Jetbrain Robotics,Health Care,Seed,70000,Gurgaon,"Jetbrain Robotics is Hong Kong / Gurgaon based company, building advanced robotic transportation solutions for multi speciality hospitals.",2018
418,Medimetry,Health Care,Seed,0,Haryana,"MediMetry is an online platform where patients can consult specialists doctors online - from anywhere, at anytime.",2018
419,Healthkart,E-Commerce,Venture - Series Unknown,10000000,Gurgaon,"The one stop shop for health, fitness & beauty.",2018
420,Indiabulls Ventures,Financial Services,Post-IPO Equity,224992070,Mumbai,Indiabulls Ventures Limited is one of India’s leading capital market companies providing securities and derivative broking services.,2018
421,Vistara,Aerospace,Private Equity,292349363,Haryana,Vistara is a joint venture of Tata Sons Limited and Singapore Airlines Limited (SIA),2018
422,ClearTax,Accounting,Series B,58469873,New Delhi,ClearTax India helps individuals prepare and e-file their Income Tax Return online.,2018
423,Shuttl,Apps,Debt Financing,1000000,Gurgaon,"Shuttl provides an app-based office shuttle service to make daily commute safe, reliable, affordable and dignified for everyone.",2018
424,GuruQ,Reading Apps,Seed,365437,New Delhi,A one of its kind digital integrated platform connecting tutors and students.,2018
425,Azure Power,Energy,Post-IPO Equity,185000000,New Delhi,"Azure Power produces and distributes solar power to commercial, government, and utility customers in India.",2018
426,Cube,Banking,Series A,2046446,Mumbai,Cube is consumer banking focused fintech company.,2018
427,RAHI Care,Health Care,Venture - Series Unknown,0,Chandigarh,RAHI Care is a Health Care company.,2018
428,Mynvax,Biotechnology,Angel,0,Bangalore,Mynvax is a biotech Company.,2018
429,Loans4SME,Financial Services,Seed,0,Mumbai,Loans4SME is an alternative lending platform.,2018
430,UpCyclersLab,Apps,Seed,0,Mumbai,UpCyclersLab is a startup that makes sustainability-based learning tools for children above the age of five.,2018
431,Cellerite Systems,Electric Vehicle,Seed,0,Hyderabad,Cellerite Systems is a charging solutions provider for electric vehicles.,2018
432,Taru Naturals,Agriculture,Seed,0,Mumbai,Taru Naturals is a network that connects farmer communities with clean technology and renewable energy.,2018
433,LetsMD,Fitness,Seed,1000000,New Delhi,LetsMD.com is a marketplace for elective surgeries,2018
434,Twenty Two Motors,Automotive,Corporate Round,65000000,Haryana,Twenty Two Motors aim of making cutting edge EV technology affordable for the current generation.,2018
435,Truebil,Automotive,Series A,2000000,Mumbai,"Truebil is a team of young, highly motivated professionals who strive to help you buy and sell used cars in the simplest way possible.",2018
436,FarmersFZ,Agriculture,Seed,0,Kochi,FarmersFZ is an online venture for fresh and safe vegetables and agri products.,2018
437,Worxogo,Information Technology,Series A,2411882,Bangalore,worxogo’s is a pioneering persuasive technology products align employee behaviours .,2018
438,Vivish Technologies (myGate),Apps,Series A,9501354,Bengaluru,India's leading mobile based security management solution .,2018
439,Singularity Dynamics,Artificial Intelligence,Seed,0,Bengaluru,Singularity Dynamics is a Chip-design testing startup.,2018
440,Virtual MetalStreet(MetalStreet),B2B,Angel,700000,Bengaluru,Virtual MetalStreet(Metalstreet) is a B2B marketplace for steel trading in India,2018
441,Veritas Finance,Financial Services,Venture - Series Unknown,30000000,Guindy,Veritas Finance has been promoted with a primary purpose of meeting the working capital and business credit requirements of the small bus.,2018
442,Manjushree Technopack,Packaging Services,Private Equity,0,Bangalore,Manjushree Technopack is a Rigid plastics packaging convertor in India and South Asia.,2018
443,GoZefo,Computer,Venture - Series Unknown,3069668,Bangalore,Startup working on a white space in the eCommerce industry.,2018
444,Zomato,Food Delivery,Secondary Market,210000000,Gurgaon,Zomato is a search app offering detailed information for restaurants as well as online food delivery.,2018
445,Innov8 Coworking,Collaboration,Seed,4000000,New Delhi,Innov8 is a Y- Combinator backed company that offers coworking and shared office spaces.,2018
446,RevFin,Accounting,Seed,0,Delhi,RevFin is a digital lending company.,2018
447,Lavelle Networks,Cloud Computing,Venture - Series Unknown,292349,Bengaluru,Lavelle Networks provides Software Defined WAN (SD-WAN) Solutions to build end to end Enterprise Networking Platforms for tomorrow,2018
448,Blackbuck,Information Services,Series D,29667613,Bengaluru,Blackbuck is a logistics startup based in India.,2018
449,Cardekho,Automotive,Series C,75000000,Gurgaon,Cardekho is a car search venture that helps users buy cars that are right for them.,2018
450,ElasticRun,Delivery,Series B,8770481,Pune,ElasticRun develops an online system that improves the reception of orders from customers and the dispatch of delivery drivers in India.,2018
451,Droom Technology Private Limited,Automotive,Series E,30000000,Gurgaon,Droom is a marketplace for automobiles and automobile services.,2018
452,Vogo Rentals,Last Mile Transportation,Debt Financing,1169397,Kormangala,Vogo is a dockless scooter rental company in India which lets customers rent scooters for short one way trips.,2018
453,InnerChef,Cooking,Venture - Series Unknown,1760000,Gurgaon,InnerChef is an online food discovery and delivery experience that will make the foodie in you come alive.,2018
454,LivQuik,FinTech,Corporate Round,2700000,Mumbai,LivQuik was incorporated with the vision to simplify payments for merchants and consumers in an increasingly digital world,2018
455,Disprz,E-Learning,Debt Financing,400000,Chennai,"Disprz is a one-of-its-kind “knowledge-tech” start-up that strives to make people knowledgeable, productive and smarter at what they do.",2018
456,9stacks,Online Games,Series A,4092891,Delhi,Online gaming startup.,2018
457,Origo,,Venture - Series Unknown,11693975,Gurgaon,"Origo Commodities, a complete post-harvest management services for agricultural commodities, is the fastest growing company in its sector.",2018
458,YourOwnROOM,Online Portals,Seed,750000,Bangalore,"Good quality, strategically located homes closer to work for millennials",2018
459,Vahdam Teas,E-Commerce,Series B,2500000,New Delhi,Vahdam Teas is a vertically integrated online-first tea brand that sources premium garden fresh teas direct from over 150+ tea plantations.,2018
460,Spoofin,Music,Venture - Series Unknown,0,New Delhi,A social networking app that lets you create and view Spoofs of your favourite videos.,2018
461,Strom Motors,Automotive,Angel,0,Mumbai,Strom Motors is a smart urban mobility Company.,2018
462,PharmEasy,Health Care,Series C,80000000,Mumbai,PharmEasy - Indias largest healthcare delivery platform,2018
463,Licious,Delivery Service,Series C,25000000,Bengaluru,"Licious is an online meat and fish ordering startup that solves existing problem of finding safe, delectable, trustworthy fresh meat.",2018
464,Stanza Living,Hospitality,Venture - Series Unknown,10670752,New Delhi,Stanza Living is a co-living platform created for students moving to a new place.,2018
465,docturnal,Biotechnology,Seed,0,Hyderabad,"Docturnal, an online platform, enables individuals to find information and diagnostic services related to diabetes, cancer, and more.",2018
466,Bounce (Metro Bikes),Autonomous Vehicles,Debt Financing,3000000,Bangalore,"Bounce (formerly Metro Bikes) is an urban mobility solution that makes daily commute stress-free, time-saving, reliable, and convenient.",2018
467,Technology 9 Labs (T9L),Information Technology,Corporate Round,0,New Delhi,Technology 9 Labs is an Information Technology and Services company.,2018
468,Goals101,Financial Services,Seed,3500000,Delhi,Goals101 is a one of the fastest growing big-data platforms.,2018
469,Satya MicroCapital,Finance,Venture - Series Unknown,5846987,New Delhi,New Delhi-based non-banking financial company.,2018
470,Ummeed Housing Finance Private Limited,Finance,Series C,8770481,Haryana,Ummeed Housing Finance Private Limited,2018
471,StockEdge,Analytics,Seed,1100000,Kolkata,"StockEdge is a unique platform, which is 100% focused on research and analytics",2018
472,Sequretek,,Venture - Series Unknown,3700000,Mumbai,Sequretek is a cyber security start-up.,2018
473,Avenues Payments India Pvt. Ltd.,,Corporate Round,1300000,Mumbai,Avenues Payments is an IT solutions provider for the remittance\money transfer and forex industries.,2018
474,Qbera,Finance,Venture - Series Unknown,2046446,Bangalore,Qbera is a managed marketplace for unsecured personal loans.,2018
475,Urban Ladder,E-Commerce,Debt Financing,5600000,Bangalore,Urban Ladder is a Bangalore-based online furniture company.,2018
476,Planet11 eCommerce Solutions India (Avenue11),,Corporate Round,3800542,Bengaluru,"Planet11 is backed by SK Planet, which is a part of the SK Group – one of the largest conglomerates in South Korea.",2018
477,DailyNinja,Apps,Series A,0,Bengaluru,"Daily Ninja, a mobile app that delivers daily needs on a subscription model",2018
478,Iba Halal Care,,Series A,2192620,Ahmedabad,Iba Halal Care is a cosmetics brand company.,2018
479,Knocksense,News,Seed,0,Lucknow,Knocksense is a fast growing lifestyle website.,2018
480,Togedr,,Venture - Series Unknown,0,Gurgaon,Togedr is an activity discovery & booking platform.,2018
481,Parkwheels,Industrial,Seed,175410,Haryana,"Parkwheels aims at solving the big, bad & unsexy parking problems of India.",2018
482,ShareChat,Internet,Series C,99230000,Bangalore,ShareChat is a social networking and regional content platform for the fast growing Internet users in India.,2018
483,Cyclops Medtech,Health Care,Seed,1000000,Bangalore,Medtech startup working on clinical and wearable diagnostic and rehab products for neuro vestibular disorders using eye tracking technology.,2018
484,Livspace,E-Commerce,Series C,70000000,Bangalore,"Livspace is the new online shopping destination where you can design, decorate and furnish your dream home.",2018
485,NewsBytes,Apps,Seed,1000000,Gurgaon,NewsBytes provides your everyday news in a contextual timeline to reduce information overload.,2018
486,Leena AI,Artificial Intelligence,Seed,2000000,Gurgaon,Leena is smart AI powered HR companion dedicated towards engaging employees.,2018
487,Max Healthcare,Health Care,Corporate Round,0,New Delhi,Max Healthcare is one of the leading chain of hospitals in India.,2018
488,GoBolt,Logistics,Venture - Series Unknown,5846987,New Delhi,Delhi-based logistics technology.,2018
489,GoGaga,Dating,Non-equity Assistance,40000,Bangalore City,GoGaga is a new age dating app that has removed the mindless swiping on strangers and connects users through their network and find matches.,2018
490,Mate Labs,Artificial Intelligence,Seed,550000,Bangalore,Mate Labs is a machine learning solutions platform for beginners.,2018
491,Furlenco,Consumer,Series C,0,Bangalore,Furlenco is a Bangalore-based company that offers a home furniture subscription program.,2018
492,Ola,Apps,Venture - Series Unknown,50000000,Kormangala,Ola is a mobile app that brings together cab drivers and customers using technology to make transportation hassle-free in India.,2018
493,DocPrime,Health Care,Funding Round,50000000,Haryana,DocPrime offers a one-stop healthcare solution right at the comfort of patients' homes.,2018
494,CLP India Pvt. Ltd.,Energy,Private Equity,365000000,Mumbai,CLP India Pvt. Ltd. is a foreign investor in the Indian power sector.,2018
495,Xplorabox,E-Commerce,Seed,0,Noida,Xplorabox is as an educational activity box subscription startup aiming to revolutionize the early education industry.,2018
496,Myra,Apps,Venture - Series Unknown,127903,Bangalore,Myra is a unique solution of technology and operations that makes buying medicines fast and efficient.,2018
497,Vokal,Internet,Series A,1500000,Bengaluru,India's Largest Peer-to-Peer Knowledge Sharing Platform in Indian Languages.,2018
498,Kissht,Credit,Series C,30000000,Mumbai,"Kissht is a financial technology platform that enables instant, seamless credit for consumers to make purchases at digital points of sales",2018
499,Upwards Fintech,Banking,Series A,5000000,Mumbai,Upwards Fintech financial company.,2018
500,Bon(Bonfleet Solutions),Financial Services,Seed,1140163,Pune,"Bon, a Pune-based FinTech firm was created to bring financial services to the gig-economy workforce.",2018
501,Mamaearth,E-Commerce,Series A,4000000,Gurgaon,Mamaearth is an online retailer specializing in baby and toddler products.,2018
502,BabyChakra,Child Care,Series B,0,Mumbai,BabyChakra is India's largest & most loved platform to discover the right maternity and childcare.,2018
503,Belstar Investment and Finance Private Limited,Financial Services,Venture - Series Unknown,28000000,Chennai,Belstar Investment and Finance Private Limited is a provider of scalable microfinance services to entrepreneurs.,2018
504,Naaptol,E-Commerce,Venture - Series Unknown,15000000,Mumbai,"Koku Gamer is an online platform that offers gaming related news, editorials, reviews, previews, and other content.",2018
505,Moonshine Meadery,Food and Beverage,Seed,0,Pune,Moonshine Meadery is a first craft meadery.,2018
506,Verzeo,E-Learning,Series A,5000000,Bangalore,Verzeo is anAI-focussed edtech startup.,2018
507,Haazri,Food and Beverage,Seed,182718,Mumbai,Haazri is a tea and snack quick service restaurant startup,2018
508,Connect India,Delivery Service,Angel,0,New Delhi,"To create pervasive network where connections are simpler, more powerful, more affordable, more global and more available to all.",2018
509,Flyrobe,Fashion,Series B,3859012,Mumbai,Flyrobe is an on-demand apparel rental platform that provides premium designer wear.,2018
510,Scholify,,Pre-Seed,0,Bengaluru,Edutech,2018
511,Dream11,Fantasy Sports,Series D,100000000,Mumbai,"Dream11 is India’s Biggest Sports Game with 30 million+ users playing Fantasy Cricket, Football, Kabaddi and NBA.",2018
512,srJna,Education,Seed,0,Jaipur,"SRJNA is a brand of Elation Edtech Pvt. Ltd., which helps schools to integrate hands on, affordable and turnkey STEM.",2018
513,Nykaa,Beauty,Secondary Market,16517739,Mumbai,Nykaa.com is a premier online beauty and wellness destination,2018
514,Chaayos,Food and Beverage,Series B,11840149,New Delhi,Chaayos was born in November 2012 out of this premise - a contemporary interpretation of the chai adda.,2018
515,Heelium,Fitness,Seed,0,Pune,Heelium is an athletic footwear and wearable startup with primary focus on sports safety and sustainability.,2018
516,LT Foods,Food and Beverage,Post-IPO Equity,20464455,New Delhi,LT Foods believe that nature will continue to nurture us until we as a species continue to breathe and live.,2018
517,Multibashi,E-Learning,Seed,146175,Bengaluru,Free language learning platform.,2018
518,Cleardekho,Eyewear,Venture - Series Unknown,0,Ghaziabad,Uttar Pradesh based online eyewear marketplace.,2018
519,Dailyhunt,Information Technology,Series E,6000000,Bangalore,NewsHunt is a Bangalore based eBooks company.,2018
520,SlicePay,FinTech,Series A,14900000,Bengaluru,SlicePay is an AI based instant credit app for youngsters in India.,2018
521,Udaan,B2B,Series C,225000000,Bangalore,"Udaan is a B2B trade platform, designed specifically for small and medium businesses in India.",2018
522,Happyeasygo Group,Tourism,Series A,0,Haryana,HappyEasyGo is an online travel domain.,2018
523,Mombay,Food and Beverage,Seed,7500,Mumbai,Mombay is a unique opportunity for housewives to start household food business and avail everyone with their homemade healthy dishes.,2018
524,Droni Tech,Information Technology,Seed,511611,Mumbai,Droni Tech manufacture UAVs and develop software to service a range of industry requirements.,2018
525,Netmeds,Biotechnology,Series C,35000000,Chennai,Welcome to India's most convenient pharmacy!,2018
